{
  "protocol_version": "1.1",
  "tool_id": "T4_SEGMENTATION",
  "input_sha256": "aaaaaaaaaaaaaaaaaaaaaaaaaaaaaaaaaaaaaaaaaaaaaaaaaaaaaaaaaaaaaaaa",
  "status": "ok",
  "model_name": "Synthetic fixture, no OCR was called",
  "checkpoint_sha256": null,
  "source_width": 1024,
  "source_height": 768,
  "tool_width": 1024,
  "tool_height": 768,
  "coordinates": "canonical_norm",
  "source_to_tool": [
    [
      1,
      0,
      0
    ],
    [
      0,
      1,
      0
    ],
    [
      0,
      0,
      1
    ]
  ],
  "detections": [
    {
      "bbox_norm": [
        0.4,
        0.1,
        0.7,
        0.25
      ],
      "label": null,
      "text": null,
      "confidence": 0.4,
      "ambiguous": true
    }
  ],
  "assets": [],
  "data": {
    "prompt_set_id": "fixture_set",
    "prompt_set_sha256": "eeeeeeeeeeeeeeeeeeeeeeeeeeeeeeeeeeeeeeeeeeeeeeeeeeeeeeeeeeeeeeee",
    "label_names": [
      "person"
    ],
    "native_masks": [
      {
        "id": "mask_1",
        "label": "person",
        "prompt_index": 0,
        "score": 0.9,
        "bbox_norm": [
          0.1,
          0.2,
          0.3,
          0.4
        ],
        "mask_path": "masks/mask_1.png",
        "grid_shape": [
          768,
          1024
        ],
        "view_id": "full"
      }
    ],
    "unknown_id": 0,
    "native_masks_may_overlap": true,
    "display_label_path": "maps/labels.png",
    "preview_path": "maps/semantic.png",
    "palette_path": "maps/palette.json",
    "display_overlap_rule": "score_desc_then_prompt_index_then_instance_id",
    "unassigned_ratio": 0.8,
    "native_result_path": "raw/seg.json"
  },
  "error": null,
  "image_id": "synthetic_fixture",
  "original_sha256": "dddddddddddddddddddddddddddddddddddddddddddddddddddddddddddddddd",
  "evidence_profile_id": "cpu_probe_v1",
  "model_bundle_sha256": "bbbbbbbbbbbbbbbbbbbbbbbbbbbbbbbbbbbbbbbbbbbbbbbbbbbbbbbbbbbbbbbb",
  "components": [
    {
      "name": "synthetic_weight_not_real",
      "sha256": "bbbbbbbbbbbbbbbbbbbbbbbbbbbbbbbbbbbbbbbbbbbbbbbbbbbbbbbbbbbbbbbb"
    }
  ],
  "backend": {
    "implementation": "synthetic_fixture_no_model_called",
    "source_revision": "fixture-v1",
    "framework": "fixture",
    "framework_version": "0",
    "device": "cpu",
    "precision": "fp32",
    "environment_lock_sha256": "cccccccccccccccccccccccccccccccccccccccccccccccccccccccccccccccc"
  },
  "parameters_sha256": "a21cc1000eff583aa534c9fb377700fd106e0ff1d516330ae26373f704cbd4bf",
  "cache_key": "faf09f3cb5164b88f7d3ff18a7722f1e52b80b23c7b502ee1888683095b1e75f",
  "views": [
    {
      "id": "full",
      "grid_shape": [
        768,
        1024
      ],
      "view_to_canonical": [
        [
          0.0009765625,
          0,
          0
        ],
        [
          0,
          0.0013020833333333333,
          0
        ],
        [
          0,
          0,
          1
        ]
      ],
      "kind": "full_frame"
    }
  ],
  "quality_warnings": [
    "synthetic_fixture_no_model_called"
  ],
  "elapsed_ms": 0,
  "peak_rss_mb": null,
  "formal_eligible": false
}
